{
  "schema_version": 1,
  "generated_at": "2026-09-10T18:05:00+09:00",
  "catalogue": {
    "path": "cbrd-26659/campaign/catalogue/requirements.json",
    "hash": "sha256:b9017c207d237d191fe4fce66a35929330d3a38eecca05e69a94f94f63d725c9"
  },
  "rows": [
    {
      "row_id": "OOS-REP-02/example_rep02_largest_first/16384-release-cs",
      "requirement": "OOS-REP-02",
      "family": "Representation",
      "case": {
        "repository": "testcases",
        "path": "sql/_36_guava/cbrd_26659/cases/example_rep02_largest_first.sql",
        "name": "example_rep02_largest_first"
      },
      "configuration": {
        "page_size": 16384,
        "build_mode": "release",
        "run_mode": "client-server",
        "instrumentation_id": null,
        "services": [
          "cub_master:26659",
          "cub_server:cmp16k_example"
        ]
      },
      "run": {
        "manifest_id": "inv-EXAMPLE-0001",
        "manifest_path": "evidence/example/inv-EXAMPLE-0001.json",
        "manifest_hash": "sha256:1e18c986fbea93aac8a896c5d9804c8563d32e649020601b9af215c292d24973",
        "engine_commit": "f4299ac0cd777a2a964c1f197ae5ebf9841a4936",
        "testcase_commit": "1111111111111111111111111111111111111111",
        "context_content_hash": "sha256:c9daf3c4ed25e16356ebf3c79c55f6bb7391d76c5664675a9aaf55cd5ac11698"
      },
      "oos_evidence": {
        "status": "proven",
        "channel": "show-heap-oos",
        "reference": "evidence/example/inv-EXAMPLE-0001/show_heap_oos.txt",
        "applicability": null
      },
      "finding": {
        "latest_outcome": "PASS",
        "ever_failed": false,
        "history": [
          {
            "manifest_id": "inv-EXAMPLE-0001",
            "attempt_id": "att-EXAMPLE-0001",
            "outcome": "PASS",
            "at": "2026-09-10T18:00:41+09:00"
          }
        ],
        "gap_kind": "none",
        "summary": null
      },
      "flakiness": {
        "attempts": 1,
        "failures": 0,
        "intermittent": false,
        "consecutive_fresh_fixture_reproductions": 0,
        "deterministic_claim": false
      },
      "known_issue": {
        "ticket": null,
        "relation": "none"
      },
      "attribution": {
        "target": "unknown",
        "evidence": null,
        "note": "no failure to attribute"
      },
      "attempt_records": [
        "evidence/example/att-EXAMPLE-0001.json"
      ]
    },
    {
      "row_id": "OOS-CL-03/-/-",
      "requirement": "OOS-CL-03",
      "family": "Concurrent lifetime",
      "case": null,
      "configuration": null,
      "run": null,
      "oos_evidence": {
        "status": "missing",
        "channel": null,
        "reference": null,
        "applicability": null
      },
      "finding": {
        "latest_outcome": null,
        "ever_failed": false,
        "history": [],
        "gap_kind": "Delivery gap",
        "summary": "No case written yet (ticket 23)."
      },
      "flakiness": {
        "attempts": 0,
        "failures": 0,
        "intermittent": false,
        "consecutive_fresh_fixture_reproductions": 0,
        "deterministic_claim": false
      },
      "known_issue": {
        "ticket": "CBRD-27237",
        "relation": "related"
      },
      "attribution": {
        "target": "unknown",
        "evidence": null,
        "note": null
      },
      "attempt_records": []
    }
  ],
  "accepted_exclusions": [
    {
      "requirement": "OOS-RES-05",
      "date": "2026-09-10",
      "reason": "EXAMPLE ONLY \u2014 shows the shape of a user-accepted exclusion; not a real decision.",
      "accepted_by": "user",
      "scope": "unloaddb timing on 4 KiB pages",
      "proposed_in": "example report"
    }
  ]
}
